{
    "name": "荧光文字倒影",
    "preview": "@/imgs/preview.png",
    "description": "文本需要在app.html里修改",
    "author": "beef-potato",
    "iframe": {
        "app": "@/iframes/app.html"
    },
    "tags": [
        "动态",
        "赛博"
    ],
    "version": "0.0.1",
    "authorUrl": "https://github.com/beef-potato"
}
