{
    "name": "仙逆-李慕婉【动态】",
    "preview": "@/imgs/preview.jpg",
    "version": "1.0.1",
    "iframe": {
        "app": "@/iframes/app.html"
    },
    "author": "akFace",
    "description": "仙逆-李慕婉【动态】主题",
    "authorUrl": "https://github.com/akFace",
    "tags": [
        "动态",
        "动漫"
    ]
}
