{
    "name": "烟花【动态】",
    "preview": "@/imgs/preview.jpg",
    "version": "1.0.1",
    "iframe": {
        "app": "@/iframes/app.html"
    },
    "author": "akFace",
    "description": "提前祝大家新年快乐，喜欢烟花的可以试试哦~",
    "authorUrl": "https://github.com/akFace",
    "tags": [
        "动态",
        "自然"
    ]
}
