{
    "name": "午后金克斯【动态】",
    "preview": "@/imgs/preview.jpg",
    "description": "爆爆！",
    "author": "hope",
    "version": "0.0.0",
    "iframe": {
        "app": "@/iframes/app.html"
    },
    "tags": [
        "动态",
        "动漫",
        "游戏"
    ],
    "authorUrl": "https://github.com/Hopelsz"
}
