{
    "name": "爱的告白【动态】",
    "preview": "@/imgs/preview.jpg",
    "version": "1.0.1",
    "iframe": {
        "app": "@/iframes/app.html"
    },
    "author": "akFace",
    "description": "超好看的动态主题哦，颜色会随着时间变化",
    "tags": [
        "动态",
        "抽象"
    ],
    "authorUrl": "https://github.com/akFace"
}
