{
    "name": "星夜",
    "preview": "@/imgs/night_sky_stars_linear_gradient_hd_8k_anime_style_8013dbdf-270b-4f00-b981-5745e056aae3.png",
    "description": "背景图片",
    "author": "猫头猫",
    "version": "0.0.0",
    "tags": [
        "暗色",
        "自然"
    ],
    "authorUrl": "https://github.com/maotoumao"
}
