{
    "name": "海边公路【动态】",
    "preview": "@/imgs/preview.jpeg",
    "description": "夏日炎炎，海边公路格外美丽~",
    "author": "hope",
    "version": "0.0.0",
    "iframe": {
        "app": "@/iframes/app.html"
    },
    "tags": [
        "动态",
        "风景"
    ],
    "authorUrl": "https://github.com/Hopelsz"
}
