{
    "name": "雷电将军【动态】",
    "preview": "@/imgs/preview.jpg",
    "version": "1.0.1",
    "iframe": {
        "app": "@/iframes/app.html"
    },
    "author": "akFace",
    "description": "雷电将军【动态】主题",
    "tags": [
        "动态",
        "动漫",
        "游戏"
    ],
    "authorUrl": "https://github.com/akFace"
}
